{
  "$schema": "https://json-schema.org/draft/2020-12/schema",
  "$id": "urn:piq:two-host-owner-facts:v1",
  "title": "PIQ two-host owner facts v1",
  "description": "Explicit owner-returned facts used locally to stage six observation documents per attempt and one handback. This is not an admission or origin authentication.",
  "type": "object",
  "additionalProperties": false,
  "required": ["schema_version", "kind", "scope", "qualification", "producer_receipt_sha256", "envelope_sha256", "run_id", "attempt_ids", "authority", "attempts"],
  "properties": {
    "schema_version": {"const": 1},
    "kind": {"const": "piq_two_host_owner_facts"},
    "scope": {"const": "bounded_two_host_functional_execution_and_custody"},
    "qualification": {"const": "not_established"},
    "producer_receipt_sha256": {"$ref": "#/$defs/sha256"},
    "envelope_sha256": {"$ref": "#/$defs/sha256"},
    "run_id": {"$ref": "#/$defs/portableIdentifier"},
    "attempt_ids": {
      "type": "array",
      "minItems": 1,
      "uniqueItems": true,
      "items": {"$ref": "#/$defs/portableIdentifier"}
    },
    "authority": {"$ref": "#/$defs/authority"},
    "attempts": {
      "type": "array",
      "minItems": 1,
      "items": {"$ref": "#/$defs/attempt"}
    }
  },
  "$defs": {
    "identifier": {
      "type": "string",
      "minLength": 8,
      "maxLength": 255,
      "pattern": "^[A-Za-z0-9][A-Za-z0-9._:/@+-]{7,254}$"
    },
    "portableIdentifier": {
      "type": "string",
      "minLength": 1,
      "maxLength": 255,
      "pattern": "^[A-Za-z0-9][A-Za-z0-9._:/@+-]{0,254}$"
    },
    "sha256": {"type": "string", "pattern": "^[0-9a-f]{64}$"},
    "timestamp": {"type": "string", "pattern": "^\\d{4}-\\d{2}-\\d{2}T\\d{2}:\\d{2}:\\d{2}(?:\\.\\d{1,9})?Z$"},
    "uuid": {"type": "string", "pattern": "^[0-9a-f]{8}-[0-9a-f]{4}-[0-9a-f]{4}-[0-9a-f]{4}-[0-9a-f]{12}$"},
    "authority": {
      "type": "object",
      "additionalProperties": false,
      "required": ["owner_id", "authority_id", "attested_at"],
      "properties": {
        "owner_id": {"$ref": "#/$defs/identifier"},
        "authority_id": {"$ref": "#/$defs/identifier"},
        "attested_at": {"$ref": "#/$defs/timestamp"}
      }
    },
    "launch": {
      "type": "object",
      "additionalProperties": false,
      "required": ["launch_id", "controller_id", "execution_session_id", "started_at", "ended_at"],
      "properties": {
        "launch_id": {"$ref": "#/$defs/identifier"},
        "controller_id": {"$ref": "#/$defs/identifier"},
        "execution_session_id": {"$ref": "#/$defs/identifier"},
        "started_at": {"$ref": "#/$defs/timestamp"},
        "ended_at": {"$ref": "#/$defs/timestamp"}
      }
    },
    "rank": {
      "type": "object",
      "additionalProperties": false,
      "required": ["rank", "producer_host", "physical_host_id", "boot_id", "execution_session_id", "pid", "started_at", "ended_at", "launch_id", "controller_id"],
      "properties": {
        "rank": {"type": "integer", "minimum": 0, "maximum": 1},
        "producer_host": {"$ref": "#/$defs/portableIdentifier"},
        "physical_host_id": {"$ref": "#/$defs/sha256"},
        "boot_id": {"$ref": "#/$defs/uuid"},
        "execution_session_id": {"$ref": "#/$defs/identifier"},
        "pid": {"type": "integer", "minimum": 1},
        "started_at": {"$ref": "#/$defs/timestamp"},
        "ended_at": {"$ref": "#/$defs/timestamp"},
        "launch_id": {"$ref": "#/$defs/identifier"},
        "controller_id": {"$ref": "#/$defs/identifier"}
      }
    },
    "transport": {
      "type": "object",
      "additionalProperties": false,
      "required": ["transport_id", "protocol", "source_rank", "destination_rank", "source_pid", "destination_pid", "source_physical_host_id", "destination_physical_host_id", "execution_session_id", "sent_payload_sha256", "received_payload_sha256", "payload_size_bytes", "sent_at", "received_at"],
      "properties": {
        "transport_id": {"$ref": "#/$defs/identifier"},
        "protocol": {"enum": ["tcp", "tcp4", "tcp6"]},
        "source_rank": {"type": "integer", "minimum": 0, "maximum": 1},
        "destination_rank": {"type": "integer", "minimum": 0, "maximum": 1},
        "source_pid": {"type": "integer", "minimum": 1},
        "destination_pid": {"type": "integer", "minimum": 1},
        "source_physical_host_id": {"$ref": "#/$defs/sha256"},
        "destination_physical_host_id": {"$ref": "#/$defs/sha256"},
        "execution_session_id": {"$ref": "#/$defs/identifier"},
        "sent_payload_sha256": {"$ref": "#/$defs/sha256"},
        "received_payload_sha256": {"$ref": "#/$defs/sha256"},
        "payload_size_bytes": {"type": "integer", "minimum": 1},
        "sent_at": {"$ref": "#/$defs/timestamp"},
        "received_at": {"$ref": "#/$defs/timestamp"}
      }
    },
    "cleanup": {
      "type": "object",
      "additionalProperties": false,
      "required": ["rank", "physical_host_id", "boot_id", "execution_session_id", "pid", "launch_id", "controller_id", "transport_id", "observed_at", "pid_absent", "transport_closed", "session_terminal"],
      "properties": {
        "rank": {"type": "integer", "minimum": 0, "maximum": 1},
        "physical_host_id": {"$ref": "#/$defs/sha256"},
        "boot_id": {"$ref": "#/$defs/uuid"},
        "execution_session_id": {"$ref": "#/$defs/identifier"},
        "pid": {"type": "integer", "minimum": 1},
        "launch_id": {"$ref": "#/$defs/identifier"},
        "controller_id": {"$ref": "#/$defs/identifier"},
        "transport_id": {"$ref": "#/$defs/identifier"},
        "observed_at": {"$ref": "#/$defs/timestamp"},
        "pid_absent": {"const": true},
        "transport_closed": {"const": true},
        "session_terminal": {"const": true}
      }
    },
    "attempt": {
      "type": "object",
      "additionalProperties": false,
      "required": ["attempt_id", "launch", "ranks", "transport", "cleanup"],
      "properties": {
        "attempt_id": {"$ref": "#/$defs/portableIdentifier"},
        "launch": {"$ref": "#/$defs/launch"},
        "ranks": {"type": "array", "minItems": 2, "maxItems": 2, "items": {"$ref": "#/$defs/rank"}},
        "transport": {"$ref": "#/$defs/transport"},
        "cleanup": {"type": "array", "minItems": 2, "maxItems": 2, "items": {"$ref": "#/$defs/cleanup"}}
      }
    }
  }
}
