{
  "schema_version": 1,
  "kind": "piq_two_host_owner_facts",
  "scope": "bounded_two_host_functional_execution_and_custody",
  "qualification": "not_established",
  "producer_receipt_sha256": "1111111111111111111111111111111111111111111111111111111111111111",
  "envelope_sha256": "2222222222222222222222222222222222222222222222222222222222222222",
  "run_id": "synthetic-example-run",
  "attempt_ids": [
    "synthetic-attempt-01"
  ],
  "authority": {
    "owner_id": "owner:synthetic-example",
    "authority_id": "authority:synthetic-example",
    "attested_at": "2026-10-31T12:00:00.900Z"
  },
  "attempts": [
    {
      "attempt_id": "synthetic-attempt-01",
      "launch": {
        "launch_id": "launch:synthetic-attempt-01",
        "controller_id": "controller:synthetic-example",
        "execution_session_id": "session:synthetic-attempt-01",
        "started_at": "2026-10-31T12:00:00.100Z",
        "ended_at": "2026-10-31T12:00:00.700Z"
      },
      "ranks": [
        {
          "rank": 0,
          "producer_host": "synthetic-target-0",
          "physical_host_id": "3333333333333333333333333333333333333333333333333333333333333333",
          "boot_id": "00000000-0000-4000-8000-000000000001",
          "execution_session_id": "session:synthetic-attempt-01",
          "pid": 100,
          "started_at": "2026-10-31T12:00:00.200Z",
          "ended_at": "2026-10-31T12:00:00.600Z",
          "launch_id": "launch:synthetic-attempt-01",
          "controller_id": "controller:synthetic-example"
        },
        {
          "rank": 1,
          "producer_host": "synthetic-target-1",
          "physical_host_id": "4444444444444444444444444444444444444444444444444444444444444444",
          "boot_id": "00000000-0000-4000-8000-000000000002",
          "execution_session_id": "session:synthetic-attempt-01",
          "pid": 101,
          "started_at": "2026-10-31T12:00:00.210Z",
          "ended_at": "2026-10-31T12:00:00.610Z",
          "launch_id": "launch:synthetic-attempt-01",
          "controller_id": "controller:synthetic-example"
        }
      ],
      "transport": {
        "transport_id": "transport:synthetic-attempt-01",
        "protocol": "tcp",
        "source_rank": 0,
        "destination_rank": 1,
        "source_pid": 100,
        "destination_pid": 101,
        "source_physical_host_id": "3333333333333333333333333333333333333333333333333333333333333333",
        "destination_physical_host_id": "4444444444444444444444444444444444444444444444444444444444444444",
        "execution_session_id": "session:synthetic-attempt-01",
        "sent_payload_sha256": "5555555555555555555555555555555555555555555555555555555555555555",
        "received_payload_sha256": "5555555555555555555555555555555555555555555555555555555555555555",
        "payload_size_bytes": 32,
        "sent_at": "2026-10-31T12:00:00.300Z",
        "received_at": "2026-10-31T12:00:00.310Z"
      },
      "cleanup": [
        {
          "rank": 0,
          "physical_host_id": "3333333333333333333333333333333333333333333333333333333333333333",
          "boot_id": "00000000-0000-4000-8000-000000000001",
          "execution_session_id": "session:synthetic-attempt-01",
          "pid": 100,
          "launch_id": "launch:synthetic-attempt-01",
          "controller_id": "controller:synthetic-example",
          "transport_id": "transport:synthetic-attempt-01",
          "observed_at": "2026-10-31T12:00:00.800Z",
          "pid_absent": true,
          "transport_closed": true,
          "session_terminal": true
        },
        {
          "rank": 1,
          "physical_host_id": "4444444444444444444444444444444444444444444444444444444444444444",
          "boot_id": "00000000-0000-4000-8000-000000000002",
          "execution_session_id": "session:synthetic-attempt-01",
          "pid": 101,
          "launch_id": "launch:synthetic-attempt-01",
          "controller_id": "controller:synthetic-example",
          "transport_id": "transport:synthetic-attempt-01",
          "observed_at": "2026-10-31T12:00:00.810Z",
          "pid_absent": true,
          "transport_closed": true,
          "session_terminal": true
        }
      ]
    }
  ]
}
